{
  "schema_version": "2.0",
  "episode": {
    "blogger": "赖导AboutLai",
    "title": "去中国房价最低城市鹤岗旅行，和想象中很不一样",
    "bvid": "BV1UetHeTEsH",
    "url": "https://www.bilibili.com/video/BV1UetHeTEsH",
    "duration": "34:07",
    "publish_date": "2024-09-19",
    "stats": {
      "views": 6693722,
      "likes": 108766,
      "favorites": 37521,
      "danmaku": 26344,
      "comments": null,
      "captured_at": null
    },
    "tags": [
      "鹤岗",
      "黑龙江",
      "房价",
      "小城旅行",
      "东北"
    ],
    "description": "鹤岗因为房价常年处在全国最低位，所以被人们所熟知。花两三万就能买套房的传说流传于互联网。所以我就很感兴趣，鹤岗这座城市到底怎么样？为了亲身感受一下，我在9月初买好了机票+火车票，来到了鹤岗旅行。",
    "related_videos": [],
    "part_number": null,
    "series": null,
    "duration_seconds": 2047
  },
  "trip": {
    "title": "去中国房价最低城市鹤岗旅行（2天）",
    "route_summary": "哈尔滨 →（火车）→ 鹤岗：新世纪广场市中心 → 鹤岗小串 → 松鹤小区（台湾大叔）→ 平安宝塔 → 鹤岗二中 → 儿童公园 → 国家矿山公园",
    "direction": "哈尔滨向东（黑龙江东部）",
    "season": "初秋（9月，10-25°C）",
    "duration_days": 2,
    "transport_modes": [
      "飞机+火车",
      "打车",
      "公交"
    ],
    "stops": [
      {
        "name": "哈尔滨 → 鹤岗",
        "day": null,
        "arrive_transport": "火车",
        "arrive_cost": "—",
        "activities": [
          "大片麦田玉米地，初秋北国风光；鹤岗站在市中心，到市区1.8公里"
        ],
        "lodging": null,
        "food": [],
        "cost_notes": [],
        "tips": [],
        "order": 1,
        "time": null,
        "detail": null
      },
      {
        "name": "新世纪广场（市中心）",
        "day": null,
        "arrive_transport": "步行",
        "arrive_cost": "—",
        "activities": [
          "如一精品酒店169元/晚、比优特时代广场（鹤岗CBD）、市人民医院、佳纳影城"
        ],
        "lodging": null,
        "food": [],
        "cost_notes": [],
        "tips": [],
        "order": 2,
        "time": null,
        "detail": null
      },
      {
        "name": "鹤岗小串（出租车司机推荐）",
        "day": null,
        "arrive_transport": "打车",
        "arrive_cost": "—",
        "activities": [
          "三分熟小肉肠、老虎菜；会员价/普通价两套价格"
        ],
        "lodging": null,
        "food": [],
        "cost_notes": [],
        "tips": [],
        "order": 3,
        "time": null,
        "detail": null
      },
      {
        "name": "松鹤小区（台湾大叔租住房）",
        "day": null,
        "arrive_transport": "公交21路（1元）",
        "arrive_cost": "租房5800元/年",
        "activities": [
          "46岁台北大叔鹤岗生活实录：包物业取暖宽带，睡帐篷想骑行流浪"
        ],
        "lodging": null,
        "food": [],
        "cost_notes": [],
        "tips": [],
        "order": 4,
        "time": null,
        "detail": null
      },
      {
        "name": "平安宝塔",
        "day": null,
        "arrive_transport": "打车",
        "arrive_cost": "—",
        "activities": [
          "鹤岗标志性建筑（近年新建），可登塔看鹤岗全景+老照片展"
        ],
        "lodging": null,
        "food": [],
        "cost_notes": [],
        "tips": [],
        "order": 5,
        "time": null,
        "detail": null
      },
      {
        "name": "鹤岗二中（学区房广告墙）",
        "day": null,
        "arrive_transport": "步行",
        "arrive_cost": "—",
        "activities": [
          "81平米20万、市中心3000元/平；13元自助盒饭就在附近"
        ],
        "lodging": null,
        "food": [],
        "cost_notes": [],
        "tips": [],
        "order": 6,
        "time": null,
        "detail": null
      },
      {
        "name": "儿童公园",
        "day": null,
        "arrive_transport": "步行",
        "arrive_cost": "免费",
        "activities": [
          "原美海公园，曾养孔雀黑熊（熊园遗址），现为老年人活动地"
        ],
        "lodging": null,
        "food": [],
        "cost_notes": [],
        "tips": [],
        "order": 7,
        "time": null,
        "detail": null
      },
      {
        "name": "鹤岗国家矿山公园",
        "day": null,
        "arrive_transport": "打车（东山区）",
        "arrive_cost": "免费",
        "activities": [
          "废弃露天煤矿遗址（最深处130米），十二生肖雕塑、煤矿工人历史"
        ],
        "lodging": null,
        "food": [],
        "cost_notes": [],
        "tips": [],
        "order": 8,
        "time": null,
        "detail": null
      }
    ],
    "suitable_for": "好奇中国房价最低城市、想低成本体验东北小城生活的人；哈尔滨出发1-2天可往返",
    "customization_notes": "B站 BV1UetHeTEsH 全文转写（SenseVoice，6638字）+ 视频原话",
    "locations": [],
    "themes": [],
    "budget": {
      "total": null,
      "per_person": null,
      "note": "视频内明确价格：酒店169元/晚、出租车3公里内7元、公交1元、13元自助盒饭、台湾大叔租房5800元/年（包物业取暖宽带）、卖房参考44平3.5万起/二中学区81平20万",
      "price_as_of": "2024-09",
      "items": []
    }
  },
  "highlights": [
    "两三万买房传说的真相：44平3.5万起，市中心学区房81平20万",
    "台湾46岁大叔5800元/年租房生活实录",
    "13元自助盒饭：烤肉3种+素菜随便吃",
    "鹤岗国家矿山公园：130米深废弃露天矿坑",
    "儿童公园：原美海公园，孔雀黑熊的熊园遗址"
  ],
  "last_updated": "2026-08-19",
  "data_status": "draft",
  "source_note": "鹤岗站在市中心（1.8公里）；9月初秋高气爽；矿山公园在市区最北，需打车",
  "tips": [
    {
      "category": "其他",
      "text": "住市中心最方便"
    },
    {
      "category": "其他",
      "text": "出租车便宜"
    },
    {
      "category": "其他",
      "text": "看房价别只看传单"
    },
    {
      "category": "其他",
      "text": "鹤岗小串认准三分熟"
    },
    {
      "category": "其他",
      "text": "13元自助盒饭性价比王"
    },
    {
      "category": "其他",
      "text": "矿山公园看煤城兴衰"
    },
    {
      "category": "其他",
      "text": "儿童公园是老年大本营"
    }
  ],
  "next_stop": null,
  "last_checked_at": null
}