{
  "schema_version": "2.0",
  "episode": {
    "blogger": "赖导AboutLai",
    "blogger_mid": "480670664",
    "title": "从漠河穿越大兴安岭去呼伦贝尔，在夏至的东北来一场独行之旅",
    "bvid": "BV19PGwzrEvW",
    "url": "https://www.bilibili.com/video/BV19PGwzrEvW",
    "duration": "50:41",
    "publish_date": "2025-07-09",
    "stats": {
      "views": 1665568,
      "likes": 63247,
      "favorites": 19791,
      "danmaku": 12825,
      "comments": 3037,
      "captured_at": null
    },
    "tags": [
      "漠河",
      "呼伦贝尔",
      "自驾游",
      "火车",
      "一人公司",
      "东北",
      "大兴安岭",
      "夏至"
    ],
    "description": "每年6月21日左右，是中国24节气中的“夏至”。夏至这天，太阳直射地面的位置到达一年中的最北端，几乎直射北回归线。此时，北半球各地的白昼时间达到全年最长，比如中国最北端的城市漠河，夏至的白天时长会达到将近20个小时。为了体验下这种超长白昼的新奇感，也为了迎接即将到来的盛夏。我决定在夏至这几天去大兴安岭旅行，而起点就选在了我曾经去过的漠河。",
    "related_videos": [],
    "part_number": null,
    "series": null,
    "duration_seconds": 3041
  },
  "trip": {
    "title": "从漠河穿越大兴安岭去呼伦贝尔（夏至独行）",
    "route_summary": "漠河 → 满归 → 根河 → 室韦 → 黑山头 → 额尔古纳",
    "direction": "北→南（倒走边防卡线公路）",
    "season": "夏至（6月21日左右）",
    "duration_days": 3,
    "transport_modes": [
      "大巴",
      "绿皮慢车4182次（牙林线）",
      "自驾（根河租车，异地还车）"
    ],
    "stops": [
      {
        "name": "漠河县城",
        "day": 1,
        "arrive_transport": null,
        "arrive_cost": null,
        "activities": [
          "巨祥之家宾馆（老板热情）",
          "漠河舞厅",
          "北极星广场",
          "老街坊铁锅炖（量太大未吃）",
          "夏至极昼体验（凌晨2点天亮/晚8:30-9:30天黑）"
        ],
        "lodging": {
          "place": "巨祥之家宾馆",
          "price": "约100-180元/晚（夏至价）",
          "notes": "老板送香瓜/冰糕/糖"
        },
        "food": [],
        "cost_notes": [],
        "tips": [
          "漠河租车不能异地还车，需开回漠河"
        ],
        "order": 1,
        "time": null,
        "detail": null
      },
      {
        "name": "满归镇",
        "day": 1,
        "arrive_transport": "大巴（每天一班15:30发车，约2小时）",
        "arrive_cost": null,
        "activities": [
          "凝翠山公园（满归全景）",
          "镇区漫步（KTV/双向四车道）"
        ],
        "lodging": {
          "place": "镇上宾馆（出租车司机姐姐推荐）",
          "price": "78元/晚",
          "notes": "木质装修"
        },
        "food": [
          "手工面馆（司机推荐）"
        ],
        "cost_notes": [
          "出租车镇上6元、接送10元"
        ],
        "tips": [
          "凝翠山建议车上去走下来",
          "夏天20度/冬天零下50度",
          "森林蚊虫多"
        ],
        "order": 2,
        "time": null,
        "detail": null
      },
      {
        "name": "根河市",
        "day": 2,
        "arrive_transport": "4182次绿皮慢车（满归→根河约4小时，牙林线）",
        "arrive_cost": null,
        "activities": [
          "根河站取车（朋友从海拉尔送车来）"
        ],
        "lodging": null,
        "food": [],
        "cost_notes": [
          "租最便宜的车，可异地还车（额尔古纳/海拉尔）"
        ],
        "tips": [],
        "order": 3,
        "time": null,
        "detail": null
      },
      {
        "name": "室韦镇",
        "day": 2,
        "arrive_transport": "自驾（边防卡线公路）",
        "arrive_cost": null,
        "activities": [
          "蒙兀室韦苏木（蒙古族发源地/俄罗斯民族乡）",
          "眺望对岸俄罗斯村庄奥洛契",
          "游船（江中上下游）"
        ],
        "lodging": null,
        "food": [],
        "cost_notes": [],
        "tips": [
          "边境不能飞无人机"
        ],
        "order": 4,
        "time": null,
        "detail": null
      },
      {
        "name": "黑山头镇",
        "day": 2,
        "arrive_transport": "自驾（卡线公路，路边遇安徽养蜂人）",
        "arrive_cost": null,
        "activities": [
          "黑山头牧场仿牧体验（喂牛羊50元/射箭/穿牧服/小火车）",
          "滑草（143元含小火车，无限次）"
        ],
        "lodging": {
          "place": "黑山头镇住宿",
          "price": null,
          "notes": "片中未提及价格"
        },
        "food": [],
        "cost_notes": [
          "百花蜜40元/斤（路边）"
        ],
        "tips": [],
        "order": 5,
        "time": null,
        "detail": null
      },
      {
        "name": "额尔古纳市",
        "day": 3,
        "arrive_transport": "自驾",
        "arrive_cost": null,
        "activities": [
          "额尔古纳国家湿地公园（亚洲第一湿地）：山顶观景台看森林→草原过渡带"
        ],
        "lodging": null,
        "food": [],
        "cost_notes": [],
        "tips": [],
        "order": 6,
        "time": null,
        "detail": null
      }
    ],
    "suitable_for": "独行/火车迷/自驾爱好者；夏季避暑路线（夏至极昼体验）",
    "customization_notes": "3天紧凑行程；若时间充裕可在满归、室韦各加1天；全程约需5-7天走宽",
    "locations": [],
    "themes": [],
    "budget": {
      "total": null,
      "per_person": null,
      "note": "视频内明确价格：漠河住宿100-180元/晚、满归住宿78元/晚、满归出租车6/10元、百花蜜40元/斤、牧场仿牧50元、滑草+小火车143元；大巴/火车/租车票价片中未明",
      "price_as_of": "2025-06",
      "items": []
    }
  },
  "highlights": [
    "夏至极昼：凌晨2点天亮、白天近20小时",
    "4182次绿皮慢车：兴安林海里的摆渡车",
    "倒走边防卡线公路：中俄边境，对岸即俄罗斯村庄奥洛契",
    "路边安徽养蜂人的百花蜜（40元/斤）",
    "黑山头滑草：1350米滑道无限次",
    "额尔古纳湿地：森林→草原过渡带（亚洲第一湿地）",
    "荣耀Magic V5 AI（YOYO）规划路线的完整实践"
  ],
  "last_updated": "2026-08-18",
  "data_status": "draft",
  "source_note": "B站音频 yt-dlp下载(m4a,39MB) → faster-whisper large-v3 转写",
  "tips": [
    {
      "category": "其他",
      "text": "夏至极昼"
    },
    {
      "category": "其他",
      "text": "租车异地的坑"
    },
    {
      "category": "其他",
      "text": "漠河→满归大巴"
    },
    {
      "category": "其他",
      "text": "凝翠山怎么玩"
    },
    {
      "category": "其他",
      "text": "满归实用信息"
    },
    {
      "category": "其他",
      "text": "4182次慢车"
    },
    {
      "category": "其他",
      "text": "森林防蚊虫"
    },
    {
      "category": "其他",
      "text": "卡线公路禁飞"
    },
    {
      "category": "其他",
      "text": "蜂蜜吃法"
    },
    {
      "category": "其他",
      "text": "滑草攻略"
    },
    {
      "category": "其他",
      "text": "仿牧体验"
    },
    {
      "category": "其他",
      "text": "湿地公园看点"
    },
    {
      "category": "其他",
      "text": "赖导的旅行观"
    }
  ],
  "next_stop": null,
  "last_checked_at": null
}