{
  "schema_version": "2.0",
  "episode": {
    "blogger": "小可追太阳",
    "title": "搭火车环游中国第17站，黑龙江百年俄式小镇「一面坡」",
    "bvid": "BV1Ghjnz6EdN",
    "url": "https://www.bilibili.com/video/BV1Ghjnz6EdN",
    "duration": "34:42",
    "publish_date": "2025-05-23",
    "stats": {
      "views": 714231,
      "likes": 9331,
      "favorites": 4530,
      "danmaku": 1247,
      "comments": null,
      "captured_at": null
    },
    "tags": [
      "一面坡",
      "黑龙江",
      "中东铁路",
      "俄式小镇",
      "套娃",
      "滨绥线"
    ],
    "description": "一面坡位于黑龙江省尚志市，是中东铁路滨绥线上的百年小镇。1898年俄国铁路职工在此建站，鼎盛时期住过3000多俄国人。如今这里被称为'中国套娃之乡'，全球90%的套娃产自一面坡。",
    "related_videos": [
      {
        "type": "series",
        "bvid": "BV1HHEqzBEM1",
        "title": "搭火车环游中国·第16站：哈尔滨",
        "relation": "series"
      },
      {
        "type": "series",
        "bvid": "BV1cA7azpEVm",
        "title": "搭火车环游中国·第18站：横道河子",
        "relation": "series"
      }
    ],
    "part_number": null,
    "series": {
      "title": "搭火车环游中国",
      "series_id": "4542924",
      "episode_number": 17
    },
    "duration_seconds": 2082
  },
  "trip": {
    "title": "一面坡·百年俄式小镇+全球90%套娃产地（2天）",
    "route_summary": "哈尔滨（哈尔滨火车站）→（绿皮火车·中东铁路滨绥线）→ 一面坡：1898年俄式小站 → 春天旅馆 → 镇饭店 → 俄式小镇漫步 → 套娃作坊 → 横道河子",
    "direction": "哈尔滨向东（中东铁路滨绥线）",
    "season": "冬季（积雪，游客设施冬季关门）",
    "duration_days": 2,
    "transport_modes": [
      "绿皮火车",
      "出租车",
      "步行"
    ],
    "stops": [
      {
        "name": "哈尔滨火车站",
        "day": null,
        "arrive_transport": "—",
        "arrive_cost": "—",
        "activities": [
          "百年老站，黑色铁架铁梁，网友称为哈利波特魔法学院",
          "站台有1909年安重根刺杀伊藤博文遗址标记，站外有纪念馆"
        ],
        "lodging": null,
        "food": [],
        "cost_notes": [],
        "tips": [],
        "order": 1,
        "time": null,
        "detail": null
      },
      {
        "name": "绿皮火车·中东铁路滨绥线",
        "day": null,
        "arrive_transport": "绿皮火车",
        "arrive_cost": "—",
        "activities": [
          "从漠河方向开来的绿皮车，行驶在滨绥线上",
          "20世纪初可直接通往俄罗斯海参崴，今终点绥芬河可换乘国际列车"
        ],
        "lodging": null,
        "food": [],
        "cost_notes": [],
        "tips": [],
        "order": 2,
        "time": null,
        "detail": null
      },
      {
        "name": "一面坡火车站",
        "day": null,
        "arrive_transport": "绿皮火车",
        "arrive_cost": "—",
        "activities": [
          "1898年始建，比博主大100岁，俄罗斯风格建筑",
          "1903年中东铁路全线贯通，三面环山一面缓坡，500多名俄国铁路职工常年驻扎",
          "北边已建高铁站，老站每天仍有直达北京的列车停靠"
        ],
        "lodging": null,
        "food": [],
        "cost_notes": [],
        "tips": [],
        "order": 3,
        "time": null,
        "detail": null
      },
      {
        "name": "春天旅馆",
        "day": null,
        "arrive_transport": "步行",
        "arrive_cost": "60元/晚",
        "activities": [
          "网上查不到住宿信息，下车后现找",
          "旅馆住很多铁路员工，六张床的房间只剩一间"
        ],
        "lodging": null,
        "food": [],
        "cost_notes": [],
        "tips": [],
        "order": 4,
        "time": null,
        "detail": null
      },
      {
        "name": "镇饭店晚餐",
        "day": null,
        "arrive_transport": "步行",
        "arrive_cost": "77元",
        "activities": [
          "夫妻经营，80年代装修，墙上挂斯大林丝织肖像（1958年，苏州工艺）",
          "点酱焖川丁鱼（三花五罗十八子）+蛋黄玉米酥+大煎饼卷菜"
        ],
        "lodging": null,
        "food": [],
        "cost_notes": [],
        "tips": [],
        "order": 5,
        "time": null,
        "detail": null
      },
      {
        "name": "俄式小镇漫步（中东铁路建筑群）",
        "day": null,
        "arrive_transport": "步行",
        "arrive_cost": "免费",
        "activities": [
          "鼎盛时期住3000多俄国人，开过啤酒厂、葡萄酒厂、面粉厂",
          "疗养院旧址（1904年建，俄罗斯古典主义，现叫生活美学馆，冬天关门）",
          "41号双户型木板贴面住宅（锁着不让进）",
          "护路军司令部大楼（曾驻三个步兵连、九个骑兵连，1988年后闲置）",
          "俄式民居屋顶普遍修一排烟囱，大部分四个"
        ],
        "lodging": null,
        "food": [],
        "cost_notes": [],
        "tips": [],
        "order": 6,
        "time": null,
        "detail": null
      },
      {
        "name": "套娃作坊探访",
        "day": null,
        "arrive_transport": "出租车",
        "arrive_cost": "100多元",
        "activities": [
          "一面坡套娃占全球90%，哈尔滨、莫斯科、巴黎纪念品店大概率出自这里",
          "套娃1890年出现，俄语名Matryoshka（源自mater母亲），可嵌套20多层",
          "产业从1970年代兴起，本地盛产椴木，模仿俄罗斯制作",
          "画了20多年的画师大姐一天画30个，可定制（曾定制拉登套娃）"
        ],
        "lodging": null,
        "food": [],
        "cost_notes": [],
        "tips": [],
        "order": 7,
        "time": null,
        "detail": null
      },
      {
        "name": "告别一面坡",
        "day": null,
        "arrive_transport": "—",
        "arrive_cost": "—",
        "activities": [
          "请套娃大姐写明信片传递到下一站",
          "把哈尔滨咖啡店老板写的'欢迎来哈尔滨，祝大家永远不牙疼'留在作坊",
          "下一站横道河子（漂亮的房子、炕头烧烤、雪地里的东北虎）"
        ],
        "lodging": null,
        "food": [],
        "cost_notes": [],
        "tips": [],
        "order": 8,
        "time": null,
        "detail": null
      }
    ],
    "suitable_for": "火车旅行爱好者、俄式建筑/中东铁路历史爱好者、手工艺品收藏者",
    "customization_notes": "B站 BV1Ghjnz6EdN 全文转写（SenseVoice，120段）+ ASR 纠错（滨隋线→滨绥线、安仲根→安重根、钻木→椴木等）",
    "locations": [],
    "themes": [],
    "budget": {
      "total": null,
      "per_person": null,
      "note": "视频内明确价格：春天旅馆60元/晚、镇饭店晚饭77元、套娃一套100多元",
      "price_as_of": "2024-2025冬季",
      "items": []
    }
  },
  "highlights": [
    "百年俄式小镇：1898年建站，鼎盛时期住3000多俄国人",
    "中东铁路建筑群：疗养院旧址、护路军司令部、四烟囱民居",
    "全球90%套娃产地：画师大姐一天画30个，可定制",
    "绿皮火车滨绥线：20世纪初可直达海参崴",
    "镇饭店酱焖川丁鱼：三花五罗十八子，配大煎饼"
  ],
  "last_updated": "2026-08-26",
  "data_status": "draft",
  "source_note": "一面坡网上查不到住宿，需现找；俄式建筑集中在铁路线南侧；套娃作坊可参观定制；冬季游客设施关门",
  "tips": [
    {
      "category": "交通",
      "text": "哈尔滨火车站乘绿皮火车沿滨绥线直达一面坡；镇内可打出租车"
    },
    {
      "category": "住宿",
      "text": "网上无住宿信息，下车后现找；春天旅馆60元/晚"
    },
    {
      "category": "餐饮",
      "text": "镇饭店可吃到三花五罗十八子河鱼，酱焖做法配大煎饼"
    },
    {
      "category": "人文",
      "text": "俄式建筑集中在铁路线南侧；套娃作坊可参观定制"
    },
    {
      "category": "季节",
      "text": "冬季积雪氛围浓，但游客中心、生活美学馆等设施冬季关门"
    }
  ],
  "next_stop": "BV1cA7azpEVm",
  "last_checked_at": null
}
