{
  "schema_version": "2.0",
  "episode": {
    "blogger": "赖导AboutLai",
    "title": "云南这个“复古小城”，好像停在了旧时光里",
    "bvid": "BV1Hj1jYKECK",
    "url": "https://www.bilibili.com/video/BV1Hj1jYKECK",
    "duration": "38:28",
    "publish_date": "2024-10-28",
    "stats": {
      "views": 4011570,
      "likes": 69908,
      "favorites": 32670,
      "danmaku": 13141,
      "comments": 3928,
      "captured_at": null
    },
    "tags": [
      "个旧",
      "云南",
      "红河",
      "锡矿",
      "小城旅行",
      "躺平"
    ],
    "description": "个旧传言房价低廉，又因为地处云南四季如春，被很多人当做了心中的躺平圣地。这座城市到底怎么样？这次我决定亲身去感受一下。",
    "related_videos": [],
    "part_number": null,
    "series": null,
    "duration_seconds": 2308
  },
  "trip": {
    "title": "云南复古小城·个旧旅行（3天）",
    "route_summary": "昆明 →（火车）→ 个旧站 →（拼车）→ 市区：金湖环湖 → 巴金广场 → 选矿场遗址+市博物馆 → 老火车站美食街（糖粉小肉串）→ 地轨缆车（小香港全景）→ 法国楼餐厅 → 老阴山（索道+动物园+宝华寺）→ 街头慢走",
    "direction": "昆明向南（红河州）",
    "season": "四季如春（10月拍摄，白天20°C上下，天气多变）",
    "duration_days": 3,
    "transport_modes": [
      "飞机+火车（昆明中转）",
      "拼车/客车",
      "打车",
      "地轨缆车/索道"
    ],
    "stops": [
      {
        "name": "昆明 → 个旧",
        "day": 1,
        "arrive_transport": "火车",
        "arrive_cost": null,
        "activities": [
          "个旧无机场，昆明南站18:30发车约2.5小时",
          "火车站离市区20多公里"
        ],
        "lodging": null,
        "food": [],
        "cost_notes": [],
        "tips": [],
        "order": 1,
        "time": null,
        "detail": null
      },
      {
        "name": "红河大酒店",
        "day": 1,
        "arrive_transport": "拼车/客车",
        "arrive_cost": "拼车15元/客车10元",
        "activities": [
          "120元/晚，房间大、复古装修",
          "无空调但海拔1600米夜里凉快"
        ],
        "lodging": {
          "place": "红河大酒店",
          "price": "120元/晚",
          "notes": "市中心金湖旁"
        },
        "food": [],
        "cost_notes": [],
        "tips": [],
        "order": 2,
        "time": null,
        "detail": null
      },
      {
        "name": "金湖（环湖+巴金广场）",
        "day": 2,
        "arrive_transport": "步行",
        "arrive_cost": "免费",
        "activities": [
          "环湖一圈4-5公里",
          "南部最繁华，西岸清净",
          "巴金广场+铜像，金湖以巴金命名",
          "北回归线标志"
        ],
        "lodging": null,
        "food": [],
        "cost_notes": [],
        "tips": [],
        "order": 3,
        "time": null,
        "detail": null
      },
      {
        "name": "选矿场遗址+市博物馆",
        "day": 2,
        "arrive_transport": "打车",
        "arrive_cost": "博物馆免费",
        "activities": [
          "1910年始建选矿场，厂房改火锅店",
          "市博物馆：汉代青铜器+锡矿产业史"
        ],
        "lodging": null,
        "food": [],
        "cost_notes": [],
        "tips": [],
        "order": 4,
        "time": null,
        "detail": null
      },
      {
        "name": "老火车站美食街",
        "day": 2,
        "arrive_transport": "步行",
        "arrive_cost": "人均20-40元",
        "activities": [
          "糖粉小肉串（白砂糖粉蘸烤串）",
          "建水豆腐、凉粉米线、淄博烧烤"
        ],
        "lodging": null,
        "food": [
          "糖粉小肉串",
          "建水豆腐",
          "凉粉米线"
        ],
        "cost_notes": [],
        "tips": [],
        "order": 5,
        "time": null,
        "detail": null
      },
      {
        "name": "地轨缆车（小香港全景）",
        "day": 2,
        "arrive_transport": "缆车",
        "arrive_cost": "1元",
        "activities": [
          "山上居民通勤工具",
          "山顶看个旧密集楼房+别墅区全景"
        ],
        "lodging": null,
        "food": [],
        "cost_notes": [],
        "tips": [],
        "order": 6,
        "time": null,
        "detail": null
      },
      {
        "name": "法国楼餐厅",
        "day": 2,
        "arrive_transport": "打车",
        "arrive_cost": "人均约40元",
        "activities": [
          "个碧临屏铁路公司旧址",
          "云南菜：普洱小炒鸡18元/鸡汤白菜22元"
        ],
        "lodging": null,
        "food": [
          "普洱小炒鸡18元",
          "鸡汤白菜22元"
        ],
        "cost_notes": [],
        "tips": [],
        "order": 7,
        "time": null,
        "detail": null
      },
      {
        "name": "老阴山（4A景区）",
        "day": 3,
        "arrive_transport": "索道往返40元",
        "arrive_cost": "40元",
        "activities": [
          "海拔2100米，垂直落差400多米",
          "2700多级台阶或索道",
          "山顶宝华寺+玻璃栈道",
          "16:00前坐车下山"
        ],
        "lodging": null,
        "food": [],
        "cost_notes": [],
        "tips": [
          "下午16:00前必须下山"
        ],
        "order": 8,
        "time": null,
        "detail": null
      },
      {
        "name": "个旧动物园",
        "day": 3,
        "arrive_transport": "步行",
        "arrive_cost": "12元",
        "activities": [
          "紧凑人少",
          "孔雀/猴山/黑熊/白狐/浣熊"
        ],
        "lodging": null,
        "food": [],
        "cost_notes": [],
        "tips": [],
        "order": 9,
        "time": null,
        "detail": null
      },
      {
        "name": "街头慢走",
        "day": 3,
        "arrive_transport": "步行",
        "arrive_cost": "免费",
        "activities": [
          "工人文化宫（舞厅改书法展厅）",
          "小学放学+花鸟市场",
          "巴金《个旧》：离开个旧将近两个月，我的心还留在那个地方"
        ],
        "lodging": null,
        "food": [],
        "cost_notes": [],
        "tips": [],
        "order": 10,
        "time": null,
        "detail": null
      }
    ],
    "suitable_for": "想去个旧看看“南方鹤岗”真相、低成本小城躺平体验的人；昆明中转，2-3天",
    "customization_notes": "昆明南站18:30火车；住金湖南部；老阴山16:00前下山；糖粉小肉串在老火车站美食街",
    "locations": [],
    "themes": [],
    "budget": {
      "total": null,
      "per_person": null,
      "note": "视频内明确价格：红河大酒店120元/晚、拼车15元/客车10元、打车起步7元、地轨缆车1元、老阴山索道往返40元、动物园12元、法国楼（普洱小炒鸡18元+鸡汤白菜22元）、糖粉小肉串人均20-40元、山上小区房价约3000元/平",
      "price_as_of": "2024-10",
      "items": []
    }
  },
  "highlights": [
    "“南方鹤岗”真相：曾是云南第二大城市的世界锡都，如今房价60平10-20万",
    "糖粉小肉串：白砂糖粉蘸烤串的甜辣味",
    "地轨缆车1元上山，看个旧“小香港”全景",
    "老阴山2700级台阶/索道登顶，山顶宝华寺",
    "个旧市博物馆：汉代青铜器+锡矿产业史（免费）"
  ],
  "last_updated": "2026-08-23",
  "data_status": "draft",
  "source_note": "B站 BV1Hj1jYKECK 全文转写（faster-whisper，7375字）+ B站view API元数据",
  "tips": [
    {
      "category": "其他",
      "text": "交通：个旧没有机场"
    },
    {
      "category": "其他",
      "text": "住金湖边最方便"
    },
    {
      "category": "其他",
      "text": "天气多变，一天四季"
    },
    {
      "category": "其他",
      "text": "糖粉小肉串是灵魂"
    },
    {
      "category": "其他",
      "text": "老阴山能走就别坐索道？不"
    },
    {
      "category": "其他",
      "text": "房价要看到底"
    },
    {
      "category": "其他",
      "text": "个旧市博物馆别错过"
    },
    {
      "category": "其他",
      "text": "地轨缆车1块钱体验山城"
    }
  ],
  "next_stop": null,
  "last_checked_at": null
}