{
  "schema_version": "2.0",
  "episode": {
    "blogger": "赖导AboutLai",
    "title": "坐绿皮火车去中国最北，一个人在小城漠河的日与夜",
    "bvid": "BV1Yu4y1L7rL",
    "url": "https://www.bilibili.com/video/BV1Yu4y1L7rL",
    "duration": "31:54",
    "publish_date": "2023-11-18",
    "stats": {
      "views": 2648340,
      "likes": 125764,
      "favorites": 45399,
      "danmaku": 17481,
      "comments": null,
      "captured_at": null
    },
    "tags": [
      "漠河",
      "黑龙江",
      "绿皮火车",
      "中国最北",
      "大兴安岭",
      "漠河舞厅",
      "五六火灾"
    ],
    "description": "从哈尔滨坐19小时绿皮火车到中国最北端的城市漠河：五六火灾纪念馆、振兴街、最北电影院、漠河舞厅——一个人在小城的日与夜。",
    "related_videos": [],
    "part_number": null,
    "series": null,
    "duration_seconds": 1914
  },
  "trip": {
    "title": "中国最北·漠河县城（2天）",
    "route_summary": "上海 →（飞机）→ 哈尔滨 →（绿皮火车19h）→ 漠河：一路向北极地宾馆 → 猪肉面 → 大兴安岭五六火灾纪念馆 → 市区闲逛（老潮河/彩色平房）→ 振兴街（市中心）→ 北极星广场 → 家常菜（北三星茄子）→ 漠河舞厅 → 中国最北电影院（顶泰电影院）→ 拼车去北极村",
    "direction": "中国最北（黑龙江大兴安岭）",
    "season": "11月（淡季，白天零下4°C；旺季=11月末-年后滑雪+7-8月避暑）",
    "duration_days": 2,
    "transport_modes": [
      "飞机",
      "绿皮火车（19小时）",
      "拼车",
      "步行"
    ],
    "stops": [
      {
        "name": "哈尔滨 → 漠河（绿皮火车）",
        "day": 1,
        "arrive_transport": "绿皮火车",
        "arrive_cost": "硬卧280+/软卧390+",
        "activities": [
          "19小时，次日8点多到",
          "无餐车只有盒饭泡面",
          "广东乘客/漠河老乡同车"
        ],
        "lodging": null,
        "food": [],
        "cost_notes": [],
        "tips": [],
        "order": 1,
        "time": null,
        "detail": null
      },
      {
        "name": "一路向北极地宾馆",
        "day": 1,
        "arrive_transport": "拼车10元",
        "arrive_cost": "124元/大床房",
        "activities": [
          "前台小姐姐服务好",
          "没空调但暖气够用"
        ],
        "lodging": {
          "place": "一路向北极地宾馆",
          "price": "124元/大床房",
          "notes": "附近有67-80元更便宜"
        },
        "food": [],
        "cost_notes": [],
        "tips": [],
        "order": 2,
        "time": null,
        "detail": null
      },
      {
        "name": "猪肉面+市区早餐",
        "day": 1,
        "arrive_transport": "步行",
        "arrive_cost": "12元",
        "activities": [
          "多放青菜，清淡暖和"
        ],
        "lodging": null,
        "food": [
          "猪肉面12元"
        ],
        "cost_notes": [],
        "tips": [],
        "order": 3,
        "time": null,
        "detail": null
      },
      {
        "name": "大兴安岭五六火灾纪念馆",
        "day": 1,
        "arrive_transport": "步行",
        "arrive_cost": "免费",
        "activities": [
          "1987年特大火灾：烧28昼夜1.7万km²（约8个东京）",
          "5.8万军警民扑救",
          "展出尺度大，防火教育震撼"
        ],
        "lodging": null,
        "food": [],
        "cost_notes": [],
        "tips": [],
        "order": 4,
        "time": null,
        "detail": null
      },
      {
        "name": "市区闲逛（老潮河/彩色平房）",
        "day": 1,
        "arrive_transport": "步行",
        "arrive_cost": "免费",
        "activities": [
          "育材学校/新泽浴池",
          "五颜六色平房（旧房改造）",
          "老潮河冻冰",
          "房价最贵3000+/平"
        ],
        "lodging": null,
        "food": [],
        "cost_notes": [],
        "tips": [],
        "order": 5,
        "time": null,
        "detail": null
      },
      {
        "name": "振兴街→北极星广场",
        "day": 1,
        "arrive_transport": "步行（1公里）",
        "arrive_cost": "免费",
        "activities": [
          "漠河最中心一条街",
          "中国人民银行/漠河林业局/新华书店",
          "蜜雪冰城/最北网吧"
        ],
        "lodging": null,
        "food": [],
        "cost_notes": [],
        "tips": [],
        "order": 6,
        "time": null,
        "detail": null
      },
      {
        "name": "家常菜馆",
        "day": 1,
        "arrive_transport": "步行",
        "arrive_cost": "价未明",
        "activities": [
          "北三星茄子非常入味",
          "土豆/青椒特别脆"
        ],
        "lodging": null,
        "food": [
          "北三星茄子"
        ],
        "cost_notes": [],
        "tips": [],
        "order": 7,
        "time": null,
        "detail": null
      },
      {
        "name": "漠河舞厅",
        "day": 1,
        "arrive_transport": "步行",
        "arrive_cost": "20元/小时",
        "activities": [
          "因《漠河舞厅》走红",
          "老板循环播放，晚上7:30人多"
        ],
        "lodging": null,
        "food": [],
        "cost_notes": [],
        "tips": [],
        "order": 8,
        "time": null,
        "detail": null
      },
      {
        "name": "顶泰电影院（最北电影院）",
        "day": 1,
        "arrive_transport": "步行",
        "arrive_cost": "25元",
        "activities": [
          "《二手杰作》",
          "二楼，旁边是最北网吧"
        ],
        "lodging": null,
        "food": [],
        "cost_notes": [],
        "tips": [],
        "order": 9,
        "time": null,
        "detail": null
      },
      {
        "name": "拼车去北极村",
        "day": 2,
        "arrive_transport": "拼车",
        "arrive_cost": "拼车价未明",
        "activities": [
          "北极村/北红村两天一晚",
          "祖国最北点"
        ],
        "lodging": null,
        "food": [],
        "cost_notes": [],
        "tips": [],
        "order": 10,
        "time": null,
        "detail": null
      }
    ],
    "suitable_for": "想去中国最北、坐绿皮火车、体验极北小城的人；北极村/北红村可拼车2天",
    "customization_notes": "哈尔滨12:55发车；淡季11月白天零下4度；去北极村拼车无固定班车",
    "locations": [],
    "themes": [],
    "budget": {
      "total": null,
      "per_person": null,
      "note": "视频内明确价格：绿皮火车硬卧280+/软卧390+、拼车10元、一路向北极地宾馆124元、猪肉面12元、漠河舞厅20元/小时、电影票25元、房价最贵3000+/平",
      "price_as_of": "2023-11",
      "items": []
    }
  },
  "highlights": [
    "19小时绿皮火车去中国最北（硬卧280+，没餐车）",
    "大兴安岭五六火灾纪念馆：烧了约8个东京的震撼历史",
    "漠河舞厅20元/小时：循环播放《漠河舞厅》的打卡地",
    "中国最北电影院看《二手杰作》（25元）",
    "振兴街1平方公里老城：银行/书店/蜜雪冰城五脏俱全",
    "房价实录：最贵3000+/平，小别墅20多万一套"
  ],
  "last_updated": "2026-08-23",
  "data_status": "draft",
  "source_note": "B站 BV1Yu4y1L7rL 全文转写（SenseVoice，约1.1万字）+ B站view API元数据",
  "tips": [
    {
      "category": "其他",
      "text": "绿皮火车没餐车"
    },
    {
      "category": "其他",
      "text": "季节：冬天看雪夏天避暑"
    },
    {
      "category": "其他",
      "text": "住宿选一路向北极地宾馆"
    },
    {
      "category": "其他",
      "text": "五六火灾纪念馆值得去"
    },
    {
      "category": "其他",
      "text": "老城就一平方公里"
    },
    {
      "category": "其他",
      "text": "漠河舞厅打卡须知"
    },
    {
      "category": "其他",
      "text": "去北极村要拼车"
    }
  ],
  "next_stop": null,
  "last_checked_at": null
}