{
  "schema_version": "2.0",
  "episode": {
    "blogger": "小可追太阳",
    "blogger_mid": "1066572839",
    "title": "搭火车环游中国到达佳木斯，松花江畔吃市井美食太惬意了",
    "bvid": "BV1cD3bzwEVm",
    "url": "https://www.bilibili.com/video/BV1cD3bzwEVm",
    "duration": "36:44",
    "publish_date": "2025-07-03",
    "stats": {
      "views": 261917,
      "likes": 6453,
      "favorites": 2011,
      "danmaku": 2331,
      "comments": 700,
      "captured_at": null
    },
    "tags": [
      "佳木斯",
      "黑龙江",
      "火车旅行",
      "美食",
      "三江平原",
      "松花江"
    ],
    "description": "搭火车环游中国的第21站，到达松花江畔的冰雪小城佳木斯，这里能遇到多种多样接地气的美食。有东北版的omakase，独特风格的拌冷面，还有筋饼和烤串的搭配满足不同人的味蕾。从热腾腾的早市一直吃到胡同的夜市，松花江的风徐徐吹过知青广场，也许历史正在悄悄说话。",
    "related_videos": [],
    "part_number": null,
    "series": null,
    "duration_seconds": 2204
  },
  "trip": {
    "title": "搭火车环游中国·第21站：佳木斯（市井美食+松花江）",
    "route_summary": "双鸭山 → 佳木斯（夜市→三江省公署旧址→大世界包子铺→暖鸟书店→新兴冷面→沿江公园→知青广场→筋饼卷肉串→晋江早市）",
    "direction": "双鸭山向西（80km高铁）",
    "season": "冬季/冰雪季（视频拍摄于2025年冰雪季，7月发布）",
    "duration_days": 2,
    "transport_modes": [
      "高铁（哈佳快铁方向）",
      "步行",
      "打车"
    ],
    "stops": [
      {
        "name": "佳木斯市区（到达）",
        "day": 1,
        "arrive_transport": "双鸭山→佳木斯 高铁",
        "arrive_cost": "约25分钟",
        "activities": [
          "地名由来：满语「驿站」音译",
          "1930年升镇、1934年伪满三江省省会",
          "今为五线城市"
        ],
        "lodging": null,
        "food": [],
        "cost_notes": [],
        "tips": [
          "哈佳快铁：哈尔滨—佳木斯343km、200km/h，高寒地区最长快铁"
        ],
        "order": 1,
        "time": null,
        "detail": null
      },
      {
        "name": "佳木斯夜市",
        "day": 1,
        "arrive_transport": "步行",
        "arrive_cost": null,
        "activities": [
          "米粉糕",
          "毛蛋（烤）",
          "烤猪梅花肉串",
          "煎粉",
          "米糕",
          "串串店（东北版omakase）"
        ],
        "lodging": null,
        "food": [
          "串串1元/串",
          "煎粉",
          "米糕"
        ],
        "cost_notes": [
          "吃一顿十几块"
        ],
        "tips": [
          "店主站桌中按人控制煮制时间；吃完举手示意数签结账"
        ],
        "order": 2,
        "time": null,
        "detail": null
      },
      {
        "name": "三江省公署旧址",
        "day": 1,
        "arrive_transport": "步行（新玛特商场背后）",
        "arrive_cost": "免费",
        "activities": [
          "伪满洲国三江省省府历史建筑（1934年设省）",
          "被高楼包围，路过易忽略"
        ],
        "lodging": null,
        "food": [],
        "cost_notes": [],
        "tips": [
          "周一闭馆，正门锁了，别从后门溜进去"
        ],
        "order": 3,
        "time": null,
        "detail": null
      },
      {
        "name": "大世界包子铺（新谊街）",
        "day": 2,
        "arrive_transport": "步行",
        "arrive_cost": null,
        "activities": [
          "现包现蒸牛肉包子（约1.1元/个）",
          "自煮热牛奶（有奶皮）"
        ],
        "lodging": null,
        "food": [
          "牛肉包子",
          "热牛奶"
        ],
        "cost_notes": [
          "包子只涨一毛钱，「涨得跟没涨一样」"
        ],
        "tips": [
          "包子皮筋道，蘸醋辣椒油"
        ],
        "order": 4,
        "time": null,
        "detail": null
      },
      {
        "name": "暖鸟书店",
        "day": 2,
        "arrive_transport": "打车（建材城内）",
        "arrive_cost": null,
        "activities": [
          "中国最东边独立书店",
          "哲学/女性主义选书，免费阅读",
          "厕所留言墙+弗洛伊德画像"
        ],
        "lodging": null,
        "food": [
          "店内有饮品"
        ],
        "cost_notes": [
          "房租一年两万"
        ],
        "tips": [
          "藏在建材城里，导航到了别怀疑走错"
        ],
        "order": 5,
        "time": null,
        "detail": null
      },
      {
        "name": "新兴冷面（向阳路）",
        "day": 2,
        "arrive_transport": "步行/打车",
        "arrive_cost": null,
        "activities": [
          "佳木斯必吃拌冷面（甜辣口）",
          "小菜8元/盘：麻辣鳕鱼、干豆腐丝、豆芽、黄瓜丝"
        ],
        "lodging": null,
        "food": [
          "拌冷面",
          "麻辣鳕鱼（像番茄酱锅包肉味）"
        ],
        "cost_notes": [
          "小菜半盘半盘点，8元/盘"
        ],
        "tips": [
          "配料堆成小山，甜辣味浓"
        ],
        "order": 6,
        "time": null,
        "detail": null
      },
      {
        "name": "松花江沿江公园",
        "day": 2,
        "arrive_transport": "步行",
        "arrive_cost": "免费",
        "activities": [
          "6公里沿江步道",
          "建国十周年纪念塔（1959年建，33米）",
          "雪中江景+日落"
        ],
        "lodging": null,
        "food": [],
        "cost_notes": [],
        "tips": [
          "松花江第三次相遇：吉林（丰满水电站不冻江）→哈尔滨（冰雪游乐场）→佳木斯"
        ],
        "order": 7,
        "time": null,
        "detail": null
      },
      {
        "name": "知青广场",
        "day": 2,
        "arrive_transport": "步行（沿江向东）",
        "arrive_cost": "免费",
        "activities": [
          "「广阔天地大有作为」雕塑",
          "知青足迹：姜昆、濮存昕等",
          "1968-1976年每一年一道门"
        ],
        "lodging": null,
        "food": [],
        "cost_notes": [],
        "tips": [
          "2008年建成，纪念上山下乡运动"
        ],
        "order": 8,
        "time": null,
        "detail": null
      },
      {
        "name": "杨大厨筋饼卷肉串（生平街一带）",
        "day": 2,
        "arrive_transport": "步行",
        "arrive_cost": null,
        "activities": [
          "筋饼卷牛肉串（葱香菜）",
          "筋饼卷油边"
        ],
        "lodging": null,
        "food": [
          "筋饼卷肉串",
          "油边"
        ],
        "cost_notes": [],
        "tips": [
          "不加葱酱，肉香面香纯享，和徐州/淄博卷饼不一样"
        ],
        "order": 9,
        "time": null,
        "detail": null
      },
      {
        "name": "晋江早市（大早市）",
        "day": 2,
        "arrive_transport": "步行",
        "arrive_cost": null,
        "activities": [
          "东北大早市：现做早餐+蔬果+日用百货",
          "旧书摊淘书"
        ],
        "lodging": null,
        "food": [
          "大饼子等早餐"
        ],
        "cost_notes": [
          "《少年维特的烦恼》15元"
        ],
        "tips": [
          "早市尽头旧书摊大爷84岁很健谈，可留言接力"
        ],
        "order": 10,
        "time": null,
        "detail": null
      }
    ],
    "suitable_for": "火车旅行爱好者、东北市井美食控：双鸭山/哈尔滨出发1-2天低成本逛吃佳木斯",
    "customization_notes": "市内全部步行/打车可达；冬季需防寒；早市要天亮去；三江省公署旧址避开周一",
    "locations": [],
    "themes": [],
    "budget": {
      "total": null,
      "per_person": null,
      "note": "视频内明确价格：串串1元/串吃一顿十几块、牛肉包子约1.1元/个、拌冷面小菜8元/盘、旧书15元、暖鸟书店免费阅读（房租一年2万）等",
      "price_as_of": "2025",
      "items": []
    }
  },
  "highlights": [
    "东北版omakase：一元一串的市井串串店，店主站桌中控全局",
    "佳木斯必吃拌冷面：甜辣口配料堆成小山（新兴冷面）",
    "中国最东边的独立书店：暖鸟书店藏在建材城里",
    "松花江第三次相遇：雪中江景+建国十周年纪念塔",
    "知青广场「广阔天地大有作为」：姜昆、濮存昕的北大荒青春",
    "筋饼卷肉串：不加葱酱的肉香面香纯享"
  ],
  "last_updated": "2026-08-19",
  "data_status": "draft",
  "source_note": "B站 BV1cD3bzwEVm 全文转写（SenseVoice，37段5223字）+ 百度百科/公开资料核实地名史实",
  "tips": [
    {
      "category": "其他",
      "text": "哈佳快铁方便"
    },
    {
      "category": "其他",
      "text": "东北版omakase怎么吃"
    },
    {
      "category": "其他",
      "text": "三江省公署旧址周一闭馆"
    },
    {
      "category": "其他",
      "text": "佳木斯必吃：拌冷面"
    },
    {
      "category": "其他",
      "text": "暖鸟书店值得逛"
    },
    {
      "category": "其他",
      "text": "松花江冬天看什么"
    },
    {
      "category": "其他",
      "text": "知青广场看点"
    },
    {
      "category": "其他",
      "text": "筋饼卷肉串怎么点"
    },
    {
      "category": "其他",
      "text": "逛早市淘书"
    },
    {
      "category": "其他",
      "text": "冬季穿衣提醒"
    }
  ],
  "next_stop": null,
  "last_checked_at": null
}